{
  "$schema": "https://json-schema.org/draft/2020-12/schema",
  "$id": "application-pipeline-state.schema.json",
  "title": "ApplicationPipelineState",
  "type": "object",
  "required": [
    "schemaVersion",
    "programId",
    "targetRepositoryRoot",
    "currentModuleId",
    "modules",
    "principalDecisions",
    "intentPath",
    "technicalPrdPath",
    "technicalPrdSha256",
    "libraryCheckoutPath",
    "libraryCommitSha",
    "lastTransitionTimestamp",
    "lastTransitionActor",
    "blockers",
    "terminalState"
  ],
  "properties": {
    "schemaVersion": { "type": "integer", "const": 2 },
    "programId": { "type": "string", "minLength": 1 },
    "targetRepositoryRoot": { "type": "string", "minLength": 1 },
    "entryMode": {
      "type": "string",
      "enum": ["from-scratch", "pick-up-unfinished", "continue-after-release"]
    },
    "currentModuleId": {
      "type": "string",
      "enum": [
        "setup",
        "intake_and_definition",
        "assembly_planning",
        "execution",
        "verification_and_hardening",
        "library_contribution",
        "shipment"
      ]
    },
    "modules": {
      "type": "object",
      "required": [
        "intake_and_definition",
        "assembly_planning",
        "execution",
        "verification_and_hardening",
        "library_contribution",
        "shipment"
      ],
      "additionalProperties": false,
      "properties": {
        "setup": { "$ref": "#/$defs/moduleState" },
        "intake_and_definition": { "$ref": "#/$defs/moduleState" },
        "assembly_planning": { "$ref": "#/$defs/moduleState" },
        "execution": { "$ref": "#/$defs/moduleState" },
        "verification_and_hardening": { "$ref": "#/$defs/moduleState" },
        "library_contribution": { "$ref": "#/$defs/moduleState" },
        "shipment": { "$ref": "#/$defs/moduleState" }
      }
    },
    "principalDecisions": { "type": "array" },
    "intentPath": { "type": ["string", "null"] },
    "technicalPrdPath": { "type": ["string", "null"] },
    "technicalPrdSha256": { "type": ["string", "null"] },
    "technicalDesignPath": { "type": ["string", "null"] },
    "starterKitDecision": {
      "type": ["object", "null"],
      "properties": {
        "decision": {
          "type": "string",
          "enum": ["none", "selected", "declined"]
        },
        "kitId": { "type": ["string", "null"] },
        "matchConfidence": {
          "type": ["string", "null"],
          "enum": ["confident", "low", null]
        },
        "rationale": { "type": "string" }
      }
    },
    "libraryCheckoutPath": { "type": ["string", "null"] },
    "libraryCommitSha": { "type": ["string", "null"] },
    "lastTransitionTimestamp": { "type": ["string", "null"] },
    "lastTransitionActor": { "type": ["string", "null"] },
    "blockers": { "type": "array" },
    "terminalState": {
      "type": ["string", "null"],
      "enum": ["release_ready", "blocked", "cancelled", null]
    },
    "issues": { "type": "object" },
    "technicalPrdAcceptanceCriteria": { "type": "array" },
    "confirmedInterviewCheckpoints": {
      "type": "array",
      "items": {
        "type": "string",
        "enum": ["analysis", "prioritization", "intent"]
      }
    },
    "gateRepairBudget": { "type": "integer", "minimum": 1, "maximum": 3, "default": 3 },
    "moduleAttemptCounts": { "type": "object" },
    "gateRejectionHistory": { "type": "array" }
  },
  "allOf": [
    {
      "if": {
        "properties": { "entryMode": { "const": "from-scratch" } },
        "required": ["entryMode"]
      },
      "then": {
        "properties": {
          "modules": { "required": ["setup", "intake_and_definition", "assembly_planning", "execution", "verification_and_hardening", "library_contribution", "shipment"] }
        }
      }
    }
  ],
  "$defs": {
    "moduleState": {
      "type": "object",
      "required": ["state", "gatePath", "gateVerdict"],
      "properties": {
        "state": {
          "type": "string",
          "enum": ["pending", "active", "gate_pending", "blocked", "complete"]
        },
        "gatePath": { "type": ["string", "null"] },
        "gateVerdict": {
          "type": ["string", "null"],
          "enum": ["pass", "accepted", "rejected", "fail", null]
        },
        "attemptCount": { "type": "integer", "minimum": 0 }
      }
    }
  }
}
